Packet Index,Category,Confidence,Field_0,Field_1,Field_2,Field_3,Field_4,Field_5,Field_6
0,LABEL_1,0.5417894721031189,1,0.000000,172.31.254.2,224.0.0.251,MDNS,186,"Standard query response 0x0000 AAAA, cache flush :: NSEC, cache flush 2bde7562-da05-4a78-b15f-f3c616776b99.local"
1,LABEL_1,0.5413175225257874,2,0.000251,fe80::1bbc:ec74:f334:3e5a,ff02::fb,MDNS,206,"Standard query response 0x0000 AAAA, cache flush :: NSEC, cache flush 2bde7562-da05-4a78-b15f-f3c616776b99.local"
2,LABEL_1,0.5418881177902222,3,0.932541,Alcatel-_80:04:71,Spanning-tree-(for-bridges)_00,STP,60,RST. Root = 32768/0/00:e0:b1:c9:42:f7  Cost = 4  Port = 0x740f
3,LABEL_1,0.5417243242263794,4,1.009088,172.31.254.2,224.0.0.251,MDNS,186,"Standard query response 0x0000 AAAA, cache flush :: NSEC, cache flush 2bde7562-da05-4a78-b15f-f3c616776b99.local"
4,LABEL_1,0.5412065982818604,5,1.009407,fe80::1bbc:ec74:f334:3e5a,ff02::fb,MDNS,206,"Standard query response 0x0000 AAAA, cache flush :: NSEC, cache flush 2bde7562-da05-4a78-b15f-f3c616776b99.local"
5,LABEL_1,0.5415792465209961,6,1.416397,ZyxelCom_fd:26:61,Broadcast,0x8899,60,Realtek Layer 2 Protocols
6,LABEL_1,0.543484628200531,7,2.266480,18.97.36.14,172.31.254.61,TLSv1.2,78,Application Data
7,LABEL_1,0.5433705449104309,8,2.266967,172.31.254.61,18.97.36.14,TLSv1.2,82,Application Data
8,LABEL_1,0.5432259440422058,9,2.408996,172.31.254.61,34.104.35.123,TCP,66,55953  >  80 [SYN] Seq=0 Win=64240 Len=0 MSS=1460 WS=256 SACK_PERM=1
9,LABEL_1,0.5432224273681641,10,2.508156,172.31.254.61,51.105.71.136,TCP,66,55963  >  443 [SYN] Seq=0 Win=64240 Len=0 MSS=1460 WS=256 SACK_PERM=1
10,LABEL_1,0.5429720878601074,11,2.516039,18.97.36.14,172.31.254.61,TCP,60,443  >  55543 [ACK] Seq=25 Ack=29 Win=193 Len=0
11,LABEL_1,0.542475700378418,12,2.534407,172.31.254.61,108.177.14.102,TCP,55,55896  >  443 [ACK] Seq=1 Ack=1 Win=511 Len=1 [TCP segment of a reassembled PDU]
12,LABEL_1,0.5423526763916016,13,2.550042,172.31.254.61,74.125.131.139,TCP,55,55898  >  443 [ACK] Seq=1 Ack=1 Win=512 Len=1 [TCP segment of a reassembled PDU]
13,LABEL_1,0.5429316759109497,14,2.614952,108.177.14.102,172.31.254.61,TCP,66,443  >  55896 [ACK] Seq=1 Ack=2 Win=1045 Len=0 SLE=1 SRE=2
14,LABEL_1,0.5427584648132324,15,2.619676,51.105.71.136,172.31.254.61,TCP,66,"443  >  55963 [SYN, ACK] Seq=0 Ack=1 Win=65535 Len=0 MSS=1360 WS=256 SACK_PERM=1"
15,LABEL_1,0.5432355403900146,16,2.619744,172.31.254.61,51.105.71.136,TCP,54,55963  >  443 [ACK] Seq=1 Ack=1 Win=131840 Len=0
16,LABEL_1,0.5434200763702393,17,2.621156,172.31.254.61,51.105.71.136,TLSv1.3,571,Client Hello
17,LABEL_1,0.5430223345756531,18,2.634329,74.125.131.139,172.31.254.61,TCP,66,443  >  55898 [ACK] Seq=1 Ack=2 Win=1044 Len=0 SLE=1 SRE=2
18,LABEL_1,0.5431852340698242,19,2.733404,51.105.71.136,172.31.254.61,TLSv1.3,153,"Hello Retry Request, Change Cipher Spec"
19,LABEL_1,0.5433051586151123,20,2.734160,172.31.254.61,51.105.71.136,TLSv1.3,491,"Change Cipher Spec, Client Hello"
20,LABEL_1,0.5432335138320923,21,2.852076,51.105.71.136,172.31.254.61,TLSv1.3,1414,Server Hello
21,LABEL_1,0.5423737168312073,22,2.852151,51.105.71.136,172.31.254.61,TCP,1414,443  >  55963 [ACK] Seq=1460 Ack=955 Win=4194560 Len=1360 [TCP segment of a reassembled PDU]
22,LABEL_1,0.5436009764671326,23,2.852170,172.31.254.61,51.105.71.136,TCP,54,55963  >  443 [ACK] Seq=955 Ack=2820 Win=131840 Len=0
23,LABEL_1,0.5423915386199951,24,2.852266,51.105.71.136,172.31.254.61,TCP,1414,443  >  55963 [ACK] Seq=2820 Ack=955 Win=4194560 Len=1360 [TCP segment of a reassembled PDU]
24,LABEL_1,0.5434285998344421,25,2.852300,51.105.71.136,172.31.254.61,TLSv1.3,465,Application Data
25,LABEL_1,0.5434934496879578,26,2.852309,172.31.254.61,51.105.71.136,TCP,54,55963  >  443 [ACK] Seq=955 Ack=4591 Win=131840 Len=0
26,LABEL_1,0.5432934165000916,27,2.853206,172.31.254.61,51.105.71.136,TLSv1.3,1740,"Application Data, Application Data"
27,LABEL_1,0.5418325662612915,28,2.931545,Alcatel-_80:04:71,Spanning-tree-(for-bridges)_00,STP,60,RST. Root = 32768/0/00:e0:b1:c9:42:f7  Cost = 4  Port = 0x740f
28,LABEL_1,0.5433061718940735,29,2.964373,51.105.71.136,172.31.254.61,TCP,60,443  >  55963 [ACK] Seq=4591 Ack=2641 Win=4195584 Len=0
29,LABEL_1,0.5434277057647705,30,2.964815,51.105.71.136,172.31.254.61,TLSv1.3,157,Application Data
30,LABEL_1,0.5434902310371399,31,2.965761,51.105.71.136,172.31.254.61,TLSv1.3,521,Application Data
31,LABEL_1,0.5433486104011536,32,2.965782,172.31.254.61,51.105.71.136,TCP,54,55963  >  443 [ACK] Seq=2641 Ack=5162 Win=131328 Len=0
32,LABEL_1,0.5434644222259521,33,2.966075,172.31.254.61,51.105.71.136,TLSv1.3,78,Application Data
33,LABEL_1,0.5430363416671753,34,2.966114,172.31.254.61,51.105.71.136,TCP,54,"55963  >  443 [FIN, ACK] Seq=2665 Ack=5162 Win=131328 Len=0"
34,LABEL_1,0.5433598160743713,35,3.077071,51.105.71.136,172.31.254.61,TCP,60,443  >  55963 [ACK] Seq=5162 Ack=2666 Win=4195328 Len=0
35,LABEL_1,0.5432532429695129,36,3.378593,172.31.254.61,34.104.35.123,TCP,66,55954  >  443 [SYN] Seq=0 Win=64240 Len=0 MSS=1460 WS=256 SACK_PERM=1
36,LABEL_1,0.5438403487205505,37,3.473885,172.31.254.24,255.255.255.255,IPv4,99,Unknown (241)
37,LABEL_1,0.5413908362388611,38,4.419003,ZyxelCom_fd:26:61,Broadcast,0x8899,60,Realtek Layer 2 Protocols
38,LABEL_1,0.5419604778289795,39,4.932776,Alcatel-_80:04:71,Spanning-tree-(for-bridges)_00,STP,60,RST. Root = 32768/0/00:e0:b1:c9:42:f7  Cost = 4  Port = 0x740f
39,LABEL_1,0.5435769557952881,40,5.701280,172.31.254.2,239.255.255.250,SSDP,211,M-SEARCH * HTTP/1.1 
40,LABEL_1,0.5425844192504883,41,6.552808,AsustekC_ca:1b:ac,Broadcast,ARP,60,Who has 172.31.254.1? Tell 172.31.254.7
41,LABEL_1,0.5434316396713257,42,6.714109,172.31.254.2,239.255.255.250,SSDP,211,M-SEARCH * HTTP/1.1 
42,LABEL_1,0.542677104473114,43,6.797398,AsustekC_ca:1b:ac,Broadcast,ARP,60,Who has 172.31.254.1? Tell 172.31.254.7
43,LABEL_1,0.5433592200279236,44,6.863844,AsustekC_ca:1b:ac,Broadcast,ARP,60,Who has 172.31.254.7? (ARP Probe)
44,LABEL_1,0.5431915521621704,45,6.869819,172.31.254.7,224.0.0.22,IGMPv3,62,Membership Report / Join group 224.0.0.251 for any sources / Join group 239.255.255.250 for any sources
45,LABEL_1,0.5420650243759155,46,6.931867,Alcatel-_80:04:71,Spanning-tree-(for-bridges)_00,STP,60,RST. Root = 32768/0/00:e0:b1:c9:42:f7  Cost = 4  Port = 0x740f
46,LABEL_1,0.5431911945343018,47,7.369797,172.31.254.7,224.0.0.22,IGMPv3,62,Membership Report / Join group 224.0.0.251 for any sources / Join group 239.255.255.250 for any sources
47,LABEL_1,0.5415017604827881,48,7.422108,ZyxelCom_fd:26:61,Broadcast,0x8899,60,Realtek Layer 2 Protocols
48,LABEL_1,0.5434958934783936,49,7.729183,172.31.254.2,239.255.255.250,SSDP,211,M-SEARCH * HTTP/1.1 
49,LABEL_1,0.543282151222229,50,7.857332,AsustekC_ca:1b:ac,Broadcast,ARP,60,Who has 172.31.254.7? (ARP Probe)
50,LABEL_1,0.5428562164306641,51,7.867913,172.31.254.7,224.0.0.22,IGMPv3,60,Membership Report / Join group 224.0.0.252 for any sources
51,LABEL_1,0.5424143075942993,52,8.109201,172.31.254.61,64.233.164.95,TCP,55,55877  >  443 [ACK] Seq=1 Ack=1 Win=511 Len=1 [TCP segment of a reassembled PDU]
52,LABEL_1,0.542978048324585,53,8.193863,64.233.164.95,172.31.254.61,TCP,66,443  >  55877 [ACK] Seq=1 Ack=2 Win=1010 Len=0 SLE=1 SRE=2
53,LABEL_1,0.542803168296814,54,8.371522,172.31.254.7,224.0.0.22,IGMPv3,60,Membership Report / Join group 224.0.0.252 for any sources
54,LABEL_1,0.5423241853713989,55,8.695186,172.31.254.61,64.233.164.100,TCP,55,55897  >  443 [ACK] Seq=1 Ack=1 Win=510 Len=1 [TCP segment of a reassembled PDU]
55,LABEL_1,0.5433294773101807,56,8.743551,172.31.254.2,239.255.255.250,SSDP,211,M-SEARCH * HTTP/1.1 
56,LABEL_1,0.5429899096488953,57,8.779101,64.233.164.100,172.31.254.61,TCP,66,443  >  55897 [ACK] Seq=1 Ack=2 Win=1042 Len=0 SLE=1 SRE=2
57,LABEL_1,0.5433523654937744,58,8.865497,AsustekC_ca:1b:ac,Broadcast,ARP,60,Who has 172.31.254.7? (ARP Probe)
58,LABEL_1,0.5419308543205261,59,8.932140,Alcatel-_80:04:71,Spanning-tree-(for-bridges)_00,STP,60,RST. Root = 32768/0/00:e0:b1:c9:42:f7  Cost = 4  Port = 0x740f
59,LABEL_1,0.5432859063148499,60,9.381723,172.31.254.61,34.104.35.123,TCP,66,55964  >  443 [SYN] Seq=0 Win=64240 Len=0 MSS=1460 WS=256 SACK_PERM=1
60,LABEL_1,0.5441690683364868,61,9.865171,AsustekC_ca:1b:ac,Broadcast,ARP,60,ARP Announcement for 172.31.254.7
61,LABEL_1,0.5428912043571472,62,9.876126,172.31.254.7,224.0.0.22,IGMPv3,60,Membership Report / Leave group 224.0.0.252
62,LABEL_1,0.5429278016090393,63,9.881788,172.31.254.7,224.0.0.22,IGMPv3,60,Membership Report / Join group 224.0.0.252 for any sources
63,LABEL_1,0.5437509417533875,64,9.944478,172.31.254.7,172.31.254.255,IPv4,167,Unknown (241)
64,LABEL_1,0.5437542200088501,65,9.944478,172.31.254.7,172.31.254.255,IPv4,167,Unknown (241)
65,LABEL_1,0.5438764691352844,66,10.157239,172.31.254.7,172.31.254.255,IPv4,167,Unknown (241)
66,LABEL_1,0.5433162450790405,67,10.157239,23.223.245.136,172.31.254.61,TLSv1.2,85,Encrypted Alert
67,LABEL_1,0.5431653261184692,68,10.157310,172.31.254.61,23.223.245.136,TCP,54,55956  >  443 [ACK] Seq=1 Ack=32 Win=1023 Len=0
68,LABEL_1,0.5427716374397278,69,10.157345,23.223.245.136,172.31.254.61,TCP,60,"443  >  55956 [FIN, ACK] Seq=32 Ack=1 Win=509 Len=0"
69,LABEL_1,0.543239414691925,70,10.157358,172.31.254.61,23.223.245.136,TCP,54,55956  >  443 [ACK] Seq=1 Ack=33 Win=1023 Len=0
70,LABEL_1,0.5429021716117859,71,10.157385,172.31.254.61,23.223.245.136,TCP,54,"55956  >  443 [FIN, ACK] Seq=1 Ack=33 Win=1023 Len=0"
71,LABEL_1,0.5434746742248535,72,10.174226,23.223.245.136,172.31.254.61,TLSv1.2,85,Encrypted Alert
72,LABEL_1,0.5430139899253845,73,10.174226,23.223.245.136,172.31.254.61,TCP,60,"443  >  55957 [FIN, ACK] Seq=32 Ack=1 Win=509 Len=0"
73,LABEL_1,0.5432640910148621,74,10.174281,172.31.254.61,23.223.245.136,TCP,54,55957  >  443 [ACK] Seq=1 Ack=33 Win=1023 Len=0
74,LABEL_1,0.542853593826294,75,10.174313,172.31.254.61,23.223.245.136,TCP,54,"55957  >  443 [FIN, ACK] Seq=1 Ack=33 Win=1023 Len=0"
75,LABEL_1,0.5436093807220459,76,10.289961,172.31.254.61,140.82.114.21,TLSv1.2,12241,Application Data
76,LABEL_1,0.5428849458694458,77,10.371046,172.31.254.7,224.0.0.22,IGMPv3,60,Membership Report / Join group 224.0.0.252 for any sources
77,LABEL_1,0.543045699596405,78,10.383700,172.31.254.61,34.104.35.123,TCP,66,[TCP Retransmission] 55964  >  443 [SYN] Seq=0 Win=64240 Len=0 MSS=1460 WS=256 SACK_PERM=1
78,LABEL_1,0.5415570735931396,79,10.424360,ZyxelCom_fd:26:61,Broadcast,0x8899,60,Realtek Layer 2 Protocols
79,LABEL_1,0.5432364344596863,80,10.436989,23.223.245.136,172.31.254.61,TCP,60,443  >  55956 [ACK] Seq=33 Ack=2 Win=509 Len=0
80,LABEL_1,0.5432080030441284,81,10.480454,140.82.114.21,172.31.254.61,TCP,60,443  >  55944 [ACK] Seq=1 Ack=2721 Win=178 Len=0
81,LABEL_1,0.5430455207824707,82,10.480692,140.82.114.21,172.31.254.61,TCP,60,443  >  55944 [ACK] Seq=1 Ack=5441 Win=183 Len=0
82,LABEL_1,0.543126106262207,83,10.480962,140.82.114.21,172.31.254.61,TCP,60,443  >  55944 [ACK] Seq=1 Ack=8161 Win=189 Len=0
83,LABEL_1,0.5431520342826843,84,10.481242,140.82.114.21,172.31.254.61,TCP,60,443  >  55944 [ACK] Seq=1 Ack=10881 Win=195 Len=0
84,LABEL_1,0.5434771776199341,85,10.481450,140.82.114.21,172.31.254.61,TLSv1.2,102,Application Data
85,LABEL_1,0.54334557056427,86,10.525722,172.31.254.61,140.82.114.21,TCP,54,55944  >  443 [ACK] Seq=12188 Ack=49 Win=510 Len=0
86,LABEL_1,0.5431610941886902,87,10.564935,23.223.245.136,172.31.254.61,TLSv1.2,85,Encrypted Alert
87,LABEL_1,0.5431222319602966,88,10.565005,172.31.254.61,23.223.245.136,TCP,54,55958  >  443 [ACK] Seq=1 Ack=32 Win=1023 Len=0
88,LABEL_1,0.5427411794662476,89,10.565033,23.223.245.136,172.31.254.61,TCP,60,"443  >  55958 [FIN, ACK] Seq=32 Ack=1 Win=501 Len=0"
89,LABEL_1,0.5431129336357117,90,10.565047,172.31.254.61,23.223.245.136,TCP,54,55958  >  443 [ACK] Seq=1 Ack=33 Win=1023 Len=0
90,LABEL_1,0.5427348613739014,91,10.565074,172.31.254.61,23.223.245.136,TCP,54,"55958  >  443 [FIN, ACK] Seq=1 Ack=33 Win=1023 Len=0"
91,LABEL_1,0.5433929562568665,92,10.588858,172.31.254.61,18.97.36.14,TLSv1.2,294,Application Data
92,LABEL_1,0.5427653789520264,93,10.650079,172.31.254.61,23.223.245.136,TCP,54,"[TCP Retransmission] 55957  >  443 [FIN, ACK] Seq=1 Ack=33 Win=1023 Len=0"
93,LABEL_1,0.5424976944923401,94,10.697563,172.31.254.61,74.125.205.101,TCP,55,55586  >  443 [ACK] Seq=1 Ack=1 Win=515 Len=1 [TCP segment of a reassembled PDU]
94,LABEL_1,0.5437102317810059,95,10.708949,172.31.254.7,172.31.254.255,IPv4,167,Unknown (241)
95,LABEL_1,0.5430399179458618,96,10.778586,18.97.36.14,172.31.254.61,TCP,60,443  >  55543 [ACK] Seq=25 Ack=269 Win=196 Len=0
96,LABEL_1,0.5434285998344421,97,10.778706,18.97.36.14,172.31.254.61,TLSv1.2,172,Application Data
97,LABEL_1,0.5430583953857422,98,10.781495,74.125.205.101,172.31.254.61,TCP,66,443  >  55586 [ACK] Seq=1 Ack=2 Win=982 Len=0 SLE=1 SRE=2
98,LABEL_1,0.5435919165611267,99,10.796972,140.82.114.21,172.31.254.61,TLSv1.2,516,Application Data
99,LABEL_1,0.5432314872741699,100,10.820244,172.31.254.61,18.97.36.14,TCP,54,55543  >  443 [ACK] Seq=269 Ack=143 Win=511 Len=0
100,LABEL_1,0.542407751083374,101,10.820261,172.31.254.61,142.251.1.132,TCP,55,55846  >  443 [ACK] Seq=1 Ack=1 Win=510 Len=1 [TCP segment of a reassembled PDU]
101,LABEL_1,0.5431903600692749,102,10.831047,23.223.245.136,172.31.254.61,TCP,60,443  >  55958 [ACK] Seq=33 Ack=2 Win=501 Len=0
102,LABEL_1,0.5433228611946106,103,10.851817,172.31.254.61,140.82.114.21,TCP,54,55944  >  443 [ACK] Seq=12188 Ack=511 Win=515 Len=0
103,LABEL_1,0.5424886345863342,104,10.851838,172.31.254.61,74.125.205.95,TCP,55,55847  >  443 [ACK] Seq=1 Ack=1 Win=515 Len=1 [TCP segment of a reassembled PDU]
104,LABEL_1,0.5428910255432129,105,10.904590,142.251.1.132,172.31.254.61,TCP,66,443  >  55846 [ACK] Seq=1 Ack=2 Win=1029 Len=0 SLE=1 SRE=2
105,LABEL_1,0.5433586239814758,106,10.910863,23.223.245.136,172.31.254.61,TCP,60,443  >  55957 [ACK] Seq=33 Ack=2 Win=509 Len=0
106,LABEL_1,0.5418707728385925,107,10.932195,Alcatel-_80:04:71,Spanning-tree-(for-bridges)_00,STP,60,RST. Root = 32768/0/00:e0:b1:c9:42:f7  Cost = 4  Port = 0x740f
107,LABEL_1,0.5431288480758667,108,10.936176,74.125.205.95,172.31.254.61,TCP,66,443  >  55847 [ACK] Seq=1 Ack=2 Win=1002 Len=0 SLE=1 SRE=2
108,LABEL_1,0.543504536151886,109,11.474343,172.31.254.7,172.31.254.255,IPv4,167,Unknown (241)
109,LABEL_1,0.5426282286643982,110,11.920702,172.31.254.61,79.133.170.5,TCP,55,55727  >  443 [ACK] Seq=1 Ack=1 Win=64426 Len=1 [TCP segment of a reassembled PDU]
110,LABEL_1,0.5430188775062561,111,11.996449,79.133.170.5,172.31.254.61,TCP,60,443  >  55727 [ACK] Seq=1 Ack=2 Win=62529 Len=0
111,LABEL_1,0.5436016917228699,112,12.239796,172.31.254.7,172.31.254.255,IPv4,167,Unknown (241)
112,LABEL_1,0.5429599285125732,113,12.383888,172.31.254.61,34.104.35.123,TCP,66,[TCP Retransmission] 55964  >  443 [SYN] Seq=0 Win=64240 Len=0 MSS=1460 WS=256 SACK_PERM=1
113,LABEL_1,0.541817843914032,114,12.932486,Alcatel-_80:04:71,Spanning-tree-(for-bridges)_00,STP,60,RST. Root = 32768/0/00:e0:b1:c9:42:f7  Cost = 4  Port = 0x740f
114,LABEL_1,0.5435353517532349,115,12.990914,172.31.254.7,172.31.254.255,IPv4,167,Unknown (241)
115,LABEL_1,0.542475163936615,116,13.006042,172.31.254.61,79.133.171.13,TCP,55,55730  >  443 [ACK] Seq=1 Ack=1 Win=64102 Len=1 [TCP segment of a reassembled PDU]
116,LABEL_1,0.5429350137710571,117,13.077724,79.133.171.13,172.31.254.61,TCP,60,443  >  55730 [ACK] Seq=1 Ack=2 Win=59550 Len=0
117,LABEL_1,0.5423054099082947,118,13.209070,D-LinkIn_43:14:cd,9c:6b:00:63:6e:0a,ARP,60,Who has 172.31.254.61? Tell 172.31.254.1
118,LABEL_1,0.5430550575256348,119,13.209079,9c:6b:00:63:6e:0a,D-LinkIn_43:14:cd,ARP,42,172.31.254.61 is at 9c:6b:00:63:6e:0a
119,LABEL_1,0.5415083765983582,120,13.427079,ZyxelCom_fd:26:61,Broadcast,0x8899,60,Realtek Layer 2 Protocols
120,LABEL_1,0.5422331094741821,121,13.826045,172.31.254.2,224.0.0.251,MDNS,171,"Standard query response 0x0000 A, cache flush 172.31.254.2 NSEC, cache flush 374ca381-fd5f-4070-bf89-cb20b956d045.local"
121,LABEL_1,0.5415627956390381,122,13.826243,fe80::1bbc:ec74:f334:3e5a,ff02::fb,MDNS,191,"Standard query response 0x0000 A, cache flush 172.31.254.2 NSEC, cache flush 374ca381-fd5f-4070-bf89-cb20b956d045.local"
122,LABEL_1,0.5426254272460938,123,14.156831,172.31.254.61,79.133.169.27,TCP,55,55222  >  443 [ACK] Seq=1 Ack=1 Win=65280 Len=1 [TCP segment of a reassembled PDU]
123,LABEL_1,0.5431963205337524,124,14.223601,79.133.169.27,172.31.254.61,TCP,60,443  >  55222 [ACK] Seq=1 Ack=2 Win=65535 Len=0
124,LABEL_1,0.5423566102981567,125,14.632476,172.31.254.61,64.233.161.188,TCP,55,54193  >  443 [ACK] Seq=1 Ack=1 Win=512 Len=1 [TCP segment of a reassembled PDU]
125,LABEL_1,0.5430141687393188,126,14.716846,64.233.161.188,172.31.254.61,TCP,66,443  >  54193 [ACK] Seq=1 Ack=2 Win=1051 Len=0 SLE=1 SRE=2
126,LABEL_1,0.5422080755233765,127,14.829055,172.31.254.2,224.0.0.251,MDNS,171,"Standard query response 0x0000 A, cache flush 172.31.254.2 NSEC, cache flush 374ca381-fd5f-4070-bf89-cb20b956d045.local"
127,LABEL_1,0.5415148735046387,128,14.829457,fe80::1bbc:ec74:f334:3e5a,ff02::fb,MDNS,191,"Standard query response 0x0000 A, cache flush 172.31.254.2 NSEC, cache flush 374ca381-fd5f-4070-bf89-cb20b956d045.local"
128,LABEL_1,0.5425647497177124,129,14.911751,172.31.254.61,108.157.229.41,TCP,55,55876  >  443 [ACK] Seq=1 Ack=1 Win=1030 Len=1 [TCP segment of a reassembled PDU]
129,LABEL_1,0.5418493151664734,130,14.932637,Alcatel-_80:04:71,Spanning-tree-(for-bridges)_00,STP,60,RST. Root = 32768/0/00:e0:b1:c9:42:f7  Cost = 4  Port = 0x740f
130,LABEL_1,0.5429288744926453,131,14.997639,108.157.229.41,172.31.254.61,TCP,66,443  >  55876 [ACK] Seq=1 Ack=2 Win=136 Len=0 SLE=1 SRE=2
131,LABEL_1,0.5417095422744751,132,15.827108,172.31.254.2,224.0.0.251,MDNS,186,"Standard query response 0x0000 AAAA, cache flush :: NSEC, cache flush d70ba7da-a3d8-4b1b-b4d7-1cdc0c65291e.local"
132,LABEL_1,0.5411388874053955,133,15.827251,fe80::1bbc:ec74:f334:3e5a,ff02::fb,MDNS,206,"Standard query response 0x0000 AAAA, cache flush :: NSEC, cache flush d70ba7da-a3d8-4b1b-b4d7-1cdc0c65291e.local"
133,LABEL_1,0.5426191091537476,134,16.240490,172.31.254.61,79.133.171.13,TCP,55,55942  >  443 [ACK] Seq=1 Ack=1 Win=65280 Len=1 [TCP segment of a reassembled PDU]
134,LABEL_1,0.5429793000221252,135,16.312450,79.133.171.13,172.31.254.61,TCP,60,443  >  55942 [ACK] Seq=1 Ack=2 Win=63711 Len=0
135,LABEL_1,0.5431721806526184,136,16.390154,172.31.254.61,34.104.35.123,TCP,66,[TCP Retransmission] 55964  >  443 [SYN] Seq=0 Win=64240 Len=0 MSS=1460 WS=256 SACK_PERM=1
136,LABEL_1,0.5414121150970459,137,16.429713,ZyxelCom_fd:26:61,Broadcast,0x8899,60,Realtek Layer 2 Protocols
137,LABEL_1,0.5426223874092102,138,16.511261,172.31.254.61,173.194.220.106,TCP,55,55574  >  443 [ACK] Seq=1 Ack=1 Win=4118 Len=1 [TCP segment of a reassembled PDU]
138,LABEL_1,0.5431398153305054,139,16.595205,173.194.220.106,172.31.254.61,TCP,66,443  >  55574 [ACK] Seq=1 Ack=2 Win=4026 Len=0 SLE=1 SRE=2
139,LABEL_1,0.541806161403656,140,16.826187,172.31.254.2,224.0.0.251,MDNS,186,"Standard query response 0x0000 AAAA, cache flush :: NSEC, cache flush d70ba7da-a3d8-4b1b-b4d7-1cdc0c65291e.local"
140,LABEL_1,0.5410938262939453,141,16.826468,fe80::1bbc:ec74:f334:3e5a,ff02::fb,MDNS,206,"Standard query response 0x0000 AAAA, cache flush :: NSEC, cache flush d70ba7da-a3d8-4b1b-b4d7-1cdc0c65291e.local"
141,LABEL_1,0.5418400764465332,142,16.932937,Alcatel-_80:04:71,Spanning-tree-(for-bridges)_00,STP,60,RST. Root = 32768/0/00:e0:b1:c9:42:f7  Cost = 4  Port = 0x740f
142,LABEL_1,0.5426616668701172,143,17.184136,Alcatel-_80:04:71,LLDP_Multicast,LLDP,60,MA/e8:e7:32:80:04:60 MA/e8:e7:32:80:04:71 120 
143,LABEL_1,0.5426294803619385,144,17.760619,172.31.254.61,108.157.214.72,TCP,55,55879  >  443 [ACK] Seq=1 Ack=1 Win=513 Len=1 [TCP segment of a reassembled PDU]
144,LABEL_1,0.541976809501648,145,17.826311,172.31.254.2,224.0.0.251,MDNS,171,"Standard query response 0x0000 A, cache flush 172.31.254.2 NSEC, cache flush 005e1be9-0110-4eb1-af5b-f2f25eff9df4.local"
145,LABEL_1,0.5413370132446289,146,17.826553,fe80::1bbc:ec74:f334:3e5a,ff02::fb,MDNS,191,"Standard query response 0x0000 A, cache flush 172.31.254.2 NSEC, cache flush 005e1be9-0110-4eb1-af5b-f2f25eff9df4.local"
146,LABEL_1,0.5428994297981262,147,17.847406,108.157.214.72,172.31.254.61,TCP,66,443  >  55879 [ACK] Seq=1 Ack=2 Win=135 Len=0 SLE=1 SRE=2
147,LABEL_1,0.541944682598114,148,18.829314,172.31.254.2,224.0.0.251,MDNS,171,"Standard query response 0x0000 A, cache flush 172.31.254.2 NSEC, cache flush 005e1be9-0110-4eb1-af5b-f2f25eff9df4.local"
148,LABEL_1,0.5413409471511841,149,18.829740,fe80::1bbc:ec74:f334:3e5a,ff02::fb,MDNS,191,"Standard query response 0x0000 A, cache flush 172.31.254.2 NSEC, cache flush 005e1be9-0110-4eb1-af5b-f2f25eff9df4.local"
149,LABEL_1,0.5418934226036072,150,18.932964,Alcatel-_80:04:71,Spanning-tree-(for-bridges)_00,STP,60,RST. Root = 32768/0/00:e0:b1:c9:42:f7  Cost = 4  Port = 0x740f
150,LABEL_1,0.5414177179336548,151,19.432709,ZyxelCom_fd:26:61,Broadcast,0x8899,60,Realtek Layer 2 Protocols
151,LABEL_1,0.541913628578186,152,19.826259,172.31.254.2,224.0.0.251,MDNS,186,"Standard query response 0x0000 AAAA, cache flush :: NSEC, cache flush b4f87156-1953-4503-9c68-c569e1bdaaa9.local"
152,LABEL_1,0.5412322282791138,153,19.826537,fe80::1bbc:ec74:f334:3e5a,ff02::fb,MDNS,206,"Standard query response 0x0000 AAAA, cache flush :: NSEC, cache flush b4f87156-1953-4503-9c68-c569e1bdaaa9.local"
153,LABEL_1,0.5422702431678772,154,19.988703,172.31.254.61,79.133.169.5,TCP,55,55931  >  443 [ACK] Seq=1 Ack=1 Win=65217 Len=1 [TCP segment of a reassembled PDU]
154,LABEL_1,0.5431661009788513,155,20.594786,172.31.254.61,77.88.8.8,DNS,75,Standard query 0x9825 A play.google.com
155,LABEL_1,0.5429717302322388,156,20.594852,172.31.254.61,77.88.8.8,DNS,75,Standard query 0x1dc3 Unknown (65) play.google.com
156,LABEL_1,0.5431471467018127,157,20.671762,77.88.8.8,172.31.254.61,DNS,125,Standard query response 0x1dc3 Unknown (65) play.google.com SOA ns1.google.com
157,LABEL_1,0.5439669489860535,158,20.677321,77.88.8.8,172.31.254.61,DNS,171,Standard query response 0x9825 A play.google.com A 64.233.165.138 A 64.233.165.101 A 64.233.165.139 A 64.233.165.113 A 64.233.165.102 A 64.233.165.100
158,LABEL_1,0.5424928665161133,159,20.677827,172.31.254.61,108.177.14.94,TCP,54,"55917  >  443 [FIN, ACK] Seq=1 Ack=1 Win=511 Len=0"
159,LABEL_1,0.5425596237182617,160,20.677870,172.31.254.61,108.177.14.94,TCP,54,"55919  >  443 [FIN, ACK] Seq=1 Ack=1 Win=511 Len=0"
160,LABEL_1,0.5431497097015381,161,20.678035,172.31.254.61,64.233.165.138,TCP,66,55965  >  443 [SYN] Seq=0 Win=64240 Len=0 MSS=1460 WS=256 SACK_PERM=1
161,LABEL_1,0.5425176024436951,162,20.678040,172.31.254.61,64.233.164.95,TCP,54,"55918  >  443 [FIN, ACK] Seq=1 Ack=1 Win=511 Len=0"
162,LABEL_1,0.5426666736602783,163,20.758916,108.177.14.94,172.31.254.61,TCP,60,"443  >  55919 [FIN, ACK] Seq=1 Ack=2 Win=1046 Len=0"
163,LABEL_1,0.5428845286369324,164,20.758999,172.31.254.61,108.177.14.94,TCP,54,55919  >  443 [ACK] Seq=2 Ack=2 Win=511 Len=0
164,LABEL_1,0.542746901512146,165,20.760269,64.233.164.95,172.31.254.61,TCP,60,"443  >  55918 [FIN, ACK] Seq=1 Ack=2 Win=1052 Len=0"
165,LABEL_1,0.5428537130355835,166,20.760459,172.31.254.61,64.233.164.95,TCP,54,55918  >  443 [ACK] Seq=2 Ack=2 Win=511 Len=0
166,LABEL_1,0.5428359508514404,167,20.761674,64.233.165.138,172.31.254.61,TCP,66,"443  >  55965 [SYN, ACK] Seq=0 Ack=1 Win=65535 Len=0 MSS=1360 SACK_PERM=1 WS=256"
167,LABEL_1,0.5431635975837708,168,20.761732,172.31.254.61,64.233.165.138,TCP,54,55965  >  443 [ACK] Seq=1 Ack=1 Win=131840 Len=0
168,LABEL_1,0.5426689386367798,169,20.763093,108.177.14.94,172.31.254.61,TCP,60,"443  >  55917 [FIN, ACK] Seq=1 Ack=2 Win=1046 Len=0"
169,LABEL_1,0.5430437326431274,170,20.763132,172.31.254.61,108.177.14.94,TCP,54,55917  >  443 [ACK] Seq=2 Ack=2 Win=511 Len=0
170,LABEL_1,0.5432660579681396,171,20.764204,172.31.254.61,64.233.165.138,TLSv1,571,Client Hello
171,LABEL_1,0.5418403744697571,172,20.825907,172.31.254.2,224.0.0.251,MDNS,186,"Standard query response 0x0000 AAAA, cache flush :: NSEC, cache flush b4f87156-1953-4503-9c68-c569e1bdaaa9.local"
172,LABEL_1,0.5412895083427429,173,20.826182,fe80::1bbc:ec74:f334:3e5a,ff02::fb,MDNS,206,"Standard query response 0x0000 AAAA, cache flush :: NSEC, cache flush b4f87156-1953-4503-9c68-c569e1bdaaa9.local"
173,LABEL_1,0.5419288873672485,174,20.933162,Alcatel-_80:04:71,Spanning-tree-(for-bridges)_00,STP,60,RST. Root = 32768/0/00:e0:b1:c9:42:f7  Cost = 4  Port = 0x740f
174,LABEL_1,0.542739748954773,175,21.072597,172.31.254.61,64.233.165.138,TCP,571,"[TCP Retransmission] 55965  >  443 [PSH, ACK] Seq=1 Ack=1 Win=131840 Len=517"
175,LABEL_1,0.5427753329277039,176,21.389891,172.31.254.61,64.233.165.138,TCP,571,"[TCP Retransmission] 55965  >  443 [PSH, ACK] Seq=1 Ack=1 Win=131840 Len=517"
176,LABEL_1,0.5424326658248901,177,21.829269,172.31.254.2,224.0.0.251,MDNS,171,"Standard query response 0x0000 A, cache flush 172.31.254.2 NSEC, cache flush dc4ce133-ed3d-4951-88cf-0bd6f2a3d8c8.local"
177,LABEL_1,0.5417766571044922,178,21.829546,fe80::1bbc:ec74:f334:3e5a,ff02::fb,MDNS,191,"Standard query response 0x0000 A, cache flush 172.31.254.2 NSEC, cache flush dc4ce133-ed3d-4951-88cf-0bd6f2a3d8c8.local"
178,LABEL_1,0.542856752872467,179,21.990961,172.31.254.61,64.233.165.138,TCP,571,"[TCP Retransmission] 55965  >  443 [PSH, ACK] Seq=1 Ack=1 Win=131840 Len=517"
179,LABEL_1,0.5413910150527954,180,22.434981,ZyxelCom_fd:26:61,Broadcast,0x8899,60,Realtek Layer 2 Protocols
180,LABEL_1,0.5424428582191467,181,22.826953,172.31.254.2,224.0.0.251,MDNS,171,"Standard query response 0x0000 A, cache flush 172.31.254.2 NSEC, cache flush dc4ce133-ed3d-4951-88cf-0bd6f2a3d8c8.local"
181,LABEL_1,0.5417769551277161,182,22.827182,fe80::1bbc:ec74:f334:3e5a,ff02::fb,MDNS,191,"Standard query response 0x0000 A, cache flush 172.31.254.2 NSEC, cache flush dc4ce133-ed3d-4951-88cf-0bd6f2a3d8c8.local"
182,LABEL_1,0.5418292880058289,183,22.933287,Alcatel-_80:04:71,Spanning-tree-(for-bridges)_00,STP,60,RST. Root = 32768/0/00:e0:b1:c9:42:f7  Cost = 4  Port = 0x740f
183,LABEL_1,0.5428850650787354,184,23.205890,172.31.254.61,64.233.165.138,TCP,571,"[TCP Retransmission] 55965  >  443 [PSH, ACK] Seq=1 Ack=1 Win=131840 Len=517"
184,LABEL_1,0.5424975156784058,185,23.757484,172.31.254.61,140.82.112.26,TCP,55,55285  >  443 [ACK] Seq=1 Ack=1 Win=513 Len=1 [TCP segment of a reassembled PDU]
185,LABEL_1,0.5419026017189026,186,23.825978,172.31.254.2,224.0.0.251,MDNS,186,"Standard query response 0x0000 AAAA, cache flush :: NSEC, cache flush 37fef6d3-bede-4d98-9424-fdfd5071710b.local"
186,LABEL_1,0.5412803888320923,187,23.826205,fe80::1bbc:ec74:f334:3e5a,ff02::fb,MDNS,206,"Standard query response 0x0000 AAAA, cache flush :: NSEC, cache flush 37fef6d3-bede-4d98-9424-fdfd5071710b.local"
187,LABEL_1,0.5430623888969421,188,23.941156,140.82.112.26,172.31.254.61,TCP,66,443  >  55285 [ACK] Seq=1 Ack=2 Win=71 Len=0 SLE=1 SRE=2
188,LABEL_1,0.5430228114128113,189,24.390860,172.31.254.61,34.104.35.123,TCP,66,[TCP Retransmission] 55964  >  443 [SYN] Seq=0 Win=64240 Len=0 MSS=1460 WS=256 SACK_PERM=1
189,LABEL_1,0.5422481298446655,190,24.607498,172.31.254.61,93.158.134.118,TCP,55,55630  >  443 [ACK] Seq=1 Ack=1 Win=512 Len=1 [TCP segment of a reassembled PDU]
190,LABEL_1,0.542960524559021,191,24.680076,93.158.134.118,172.31.254.61,TCP,66,443  >  55630 [ACK] Seq=1 Ack=2 Win=166 Len=0 SLE=1 SRE=2
191,LABEL_1,0.5418408513069153,192,24.829030,172.31.254.2,224.0.0.251,MDNS,186,"Standard query response 0x0000 AAAA, cache flush :: NSEC, cache flush 37fef6d3-bede-4d98-9424-fdfd5071710b.local"
192,LABEL_1,0.5411587953567505,193,24.829291,fe80::1bbc:ec74:f334:3e5a,ff02::fb,MDNS,206,"Standard query response 0x0000 AAAA, cache flush :: NSEC, cache flush 37fef6d3-bede-4d98-9424-fdfd5071710b.local"
193,LABEL_1,0.5417748093605042,194,24.933462,Alcatel-_80:04:71,Spanning-tree-(for-bridges)_00,STP,60,RST. Root = 32768/0/00:e0:b1:c9:42:f7  Cost = 4  Port = 0x740f
194,LABEL_1,0.5421148538589478,195,25.091610,172.31.254.61,172.67.173.89,TCP,55,55883  >  443 [ACK] Seq=1 Ack=1 Win=513 Len=1 [TCP segment of a reassembled PDU]
195,LABEL_1,0.5429097414016724,196,25.195726,172.67.173.89,172.31.254.61,TCP,66,443  >  55883 [ACK] Seq=1 Ack=2 Win=16 Len=0 SLE=1 SRE=2
196,LABEL_1,0.5413485765457153,197,25.437688,ZyxelCom_fd:26:61,Broadcast,0x8899,60,Realtek Layer 2 Protocols
197,LABEL_1,0.542742908000946,198,25.607509,172.31.254.61,64.233.165.138,TCP,571,"[TCP Retransmission] 55965  >  443 [PSH, ACK] Seq=1 Ack=1 Win=131840 Len=517"
198,LABEL_1,0.5431156754493713,199,25.903811,172.31.254.61,77.88.8.8,DNS,77,Standard query 0x1394 A chat.deepseek.com
199,LABEL_1,0.5428204536437988,200,25.903938,172.31.254.61,77.88.8.8,DNS,77,Standard query 0x4a41 Unknown (65) chat.deepseek.com
200,LABEL_1,0.5433053374290466,201,25.905863,172.31.254.61,104.18.26.90,TLSv1.2,1769,Application Data
201,LABEL_1,0.5432858467102051,202,25.905895,172.31.254.61,104.18.26.90,TLSv1.2,93,Application Data
202,LABEL_1,0.5434694290161133,203,25.908864,172.31.254.61,79.133.169.27,TLSv1.2,130,Application Data
203,LABEL_1,0.5436071753501892,204,25.908912,172.31.254.61,79.133.169.27,TLSv1.2,133,Application Data
204,LABEL_1,0.5432344675064087,205,25.909539,172.31.254.61,104.18.26.90,TLSv1.2,126,Application Data
205,LABEL_1,0.5430198311805725,206,25.926014,172.31.254.61,77.88.8.8,DNS,76,Standard query 0x626a A gator.volces.com
206,LABEL_1,0.543034553527832,207,25.926095,172.31.254.61,77.88.8.8,DNS,76,Standard query 0x142c Unknown (65) gator.volces.com
207,LABEL_1,0.5434034466743469,208,25.977095,77.88.8.8,172.31.254.61,DNS,159,Standard query response 0x1394 A chat.deepseek.com CNAME chat.deepseek.com.cdn.cloudflare.net A 104.18.26.90 A 104.18.27.90
208,LABEL_1,0.5430211424827576,209,25.977596,79.133.169.27,172.31.254.61,TCP,60,443  >  55841 [ACK] Seq=1 Ack=156 Win=65535 Len=0
209,LABEL_1,0.5434325337409973,210,25.977639,79.133.169.27,172.31.254.61,TLSv1.2,109,Application Data
210,LABEL_1,0.5435416102409363,211,25.978119,79.133.169.27,172.31.254.61,TLSv1.2,200,Application Data
211,LABEL_1,0.5430638790130615,212,25.978138,172.31.254.61,79.133.169.27,TCP,54,55841  >  443 [ACK] Seq=156 Ack=202 Win=63976 Len=0
212,LABEL_1,0.5435524582862854,213,25.978174,79.133.169.27,172.31.254.61,TLSv1.2,135,Application Data
213,LABEL_1,0.5434725880622864,214,25.981941,140.82.121.6,172.31.254.61,TLSv1.2,93,Application Data
214,LABEL_1,0.5432506799697876,215,25.982115,172.31.254.61,140.82.121.6,TLSv1.2,93,Application Data
215,LABEL_1,0.543379008769989,216,25.982192,172.31.254.61,140.82.121.6,TLSv1.2,78,Application Data
216,LABEL_1,0.5424475073814392,217,25.982233,172.31.254.61,140.82.121.6,TCP,54,"55925  >  443 [FIN, ACK] Seq=64 Ack=40 Win=515 Len=0"
217,LABEL_1,0.5431780815124512,218,25.987102,104.18.26.90,172.31.254.61,TCP,60,443  >  55471 [ACK] Seq=1 Ack=1716 Win=17 Len=0
218,LABEL_1,0.5431985259056091,219,25.987181,77.88.8.8,172.31.254.61,DNS,161,Standard query response 0x4a41 Unknown (65) chat.deepseek.com CNAME chat.deepseek.com.cdn.cloudflare.net Unknown (65)
219,LABEL_1,0.5430662631988525,220,25.987527,104.18.26.90,172.31.254.61,TCP,60,443  >  55471 [ACK] Seq=1 Ack=1755 Win=17 Len=0
220,LABEL_1,0.5433731079101562,221,25.987876,104.18.26.90,172.31.254.61,TLSv1.2,93,Application Data
221,LABEL_1,0.5439894199371338,222,25.998393,77.88.8.8,172.31.254.61,DNS,301,Standard query response 0x626a A gator.volces.com CNAME gator.volces.com.bytedns1.com CNAME gator.volces.com.230b2a2545cfa773.queniuck.com A 104.166.182.206 A 104.166.182.205 A 104.166.182.210 A 104.166.182.211 A 104.166.182.209 A 104.166.182.212 A 104.166.182.208 A 104.166.182.207
222,LABEL_1,0.5430523157119751,223,26.004659,77.88.8.8,172.31.254.61,DNS,231,Standard query response 0x142c Unknown (65) gator.volces.com CNAME gator.volces.com.bytedns1.com CNAME gator.volces.com.230b2a2545cfa773.queniuck.com SOA vipns4.queniudns.com
223,LABEL_1,0.5433683395385742,224,26.004979,172.31.254.61,104.166.182.206,TCP,66,55966  >  443 [SYN] Seq=0 Win=64240 Len=0 MSS=1460 WS=256 SACK_PERM=1
224,LABEL_1,0.5433427691459656,225,26.024079,172.31.254.61,79.133.169.27,TCP,54,55841  >  443 [ACK] Seq=156 Ack=283 Win=65280 Len=0
225,LABEL_1,0.5430199503898621,226,26.030950,104.18.26.90,172.31.254.61,TCP,60,443  >  55471 [ACK] Seq=40 Ack=1827 Win=17 Len=0
226,LABEL_1,0.5430058240890503,227,26.040773,172.31.254.61,104.18.26.90,TCP,54,55471  >  443 [ACK] Seq=1827 Ack=40 Win=513 Len=0
227,LABEL_1,0.5428803563117981,228,26.074601,104.166.182.206,172.31.254.61,TCP,66,"443  >  55966 [SYN, ACK] Seq=0 Ack=1 Win=42340 Len=0 MSS=1360 SACK_PERM=1 WS=512"
228,LABEL_1,0.543203592300415,229,26.074688,172.31.254.61,104.166.182.206,TCP,54,55966  >  443 [ACK] Seq=1 Ack=1 Win=131840 Len=0
229,LABEL_1,0.5434612035751343,230,26.077767,172.31.254.61,104.166.182.206,TLSv1.3,571,Client Hello
230,LABEL_1,0.5428298711776733,231,26.087796,140.82.121.6,172.31.254.61,TCP,60,443  >  55925 [ACK] Seq=40 Ack=40 Win=67 Len=0
231,LABEL_1,0.5429092645645142,232,26.087796,140.82.121.6,172.31.254.61,TCP,60,443  >  55925 [ACK] Seq=40 Ack=64 Win=67 Len=0
232,LABEL_1,0.5432999134063721,233,26.087862,140.82.121.6,172.31.254.61,TLSv1.2,78,Application Data
233,LABEL_1,0.5424240231513977,234,26.087862,140.82.121.6,172.31.254.61,TCP,60,"443  >  55925 [FIN, ACK] Seq=64 Ack=64 Win=67 Len=0"
234,LABEL_1,0.5428289175033569,235,26.087863,140.82.121.6,172.31.254.61,TCP,60,443  >  55925 [ACK] Seq=65 Ack=65 Win=67 Len=0
235,LABEL_1,0.5428468585014343,236,26.087911,172.31.254.61,140.82.121.6,TCP,54,55925  >  443 [ACK] Seq=65 Ack=65 Win=515 Len=0
236,LABEL_1,0.5433980822563171,237,26.147790,104.166.182.206,172.31.254.61,TCP,60,443  >  55966 [ACK] Seq=1 Ack=518 Win=42496 Len=0
237,LABEL_1,0.5436124801635742,238,26.150247,104.166.182.206,172.31.254.61,TLSv1.3,1414,"Server Hello, Change Cipher Spec, Application Data"
238,LABEL_1,0.5429053902626038,239,26.150334,104.166.182.206,172.31.254.61,TCP,1414,443  >  55966 [ACK] Seq=1361 Ack=518 Win=42496 Len=1360 [TCP segment of a reassembled PDU]
239,LABEL_1,0.5436288714408875,240,26.150356,172.31.254.61,104.166.182.206,TCP,54,55966  >  443 [ACK] Seq=518 Ack=2721 Win=131840 Len=0
240,LABEL_1,0.543136715888977,241,26.157366,104.166.182.206,172.31.254.61,TLSv1.3,1414,Application Data [TCP segment of a reassembled PDU]
241,LABEL_1,0.5434183478355408,242,26.157441,104.166.182.206,172.31.254.61,TLSv1.3,238,"Application Data, Application Data"
242,LABEL_1,0.5434946417808533,243,26.157471,172.31.254.61,104.166.182.206,TCP,54,55966  >  443 [ACK] Seq=518 Ack=4265 Win=131840 Len=0
243,LABEL_1,0.5433061122894287,244,26.163071,172.31.254.61,104.166.182.206,TLSv1.3,118,"Change Cipher Spec, Application Data"
244,LABEL_1,0.5437710881233215,245,26.164456,172.31.254.61,104.166.182.206,TLSv1.3,612,Application Data
245,LABEL_1,0.5436526536941528,246,26.233396,104.166.182.206,172.31.254.61,TLSv1.3,349,Application Data
246,LABEL_1,0.5436416268348694,247,26.234020,104.166.182.206,172.31.254.61,TLSv1.3,349,Application Data
247,LABEL_1,0.5432586073875427,248,26.234039,172.31.254.61,104.166.182.206,TCP,54,55966  >  443 [ACK] Seq=1140 Ack=4855 Win=131328 Len=0
248,LABEL_1,0.5434026122093201,249,26.272729,104.18.26.90,172.31.254.61,TLSv1.2,381,Application Data
249,LABEL_1,0.5433748364448547,250,26.272875,104.18.26.90,172.31.254.61,TLSv1.2,381,Application Data
250,LABEL_1,0.5430683493614197,251,26.272896,172.31.254.61,104.18.26.90,TCP,54,55471  >  443 [ACK] Seq=1827 Ack=694 Win=511 Len=0
251,LABEL_1,0.5433271527290344,252,26.273019,104.18.26.90,172.31.254.61,TLSv1.2,85,Application Data
252,LABEL_1,0.5432624816894531,253,26.274537,104.166.182.206,172.31.254.61,TCP,60,443  >  55966 [ACK] Seq=4855 Ack=1140 Win=42496 Len=0
253,LABEL_1,0.5434816479682922,254,26.280198,172.31.254.61,104.18.26.90,TLSv1.2,89,Application Data
254,LABEL_1,0.5431194305419922,255,26.330190,172.31.254.61,77.88.8.8,DNS,79,Standard query 0x1210 A static.deepseek.com
255,LABEL_1,0.5430484414100647,256,26.330250,172.31.254.61,77.88.8.8,DNS,79,Standard query 0x3dd5 Unknown (65) static.deepseek.com
256,LABEL_1,0.5430647134780884,257,26.361513,104.18.26.90,172.31.254.61,TCP,60,443  >  55471 [ACK] Seq=725 Ack=1862 Win=17 Len=0
257,LABEL_1,0.5434961915016174,258,26.399041,104.166.182.206,172.31.254.61,TLSv1.3,915,Application Data
258,LABEL_1,0.5436317324638367,259,26.403281,172.31.254.61,104.166.182.206,TLSv1.3,726,Application Data
259,LABEL_1,0.5435713529586792,260,26.407095,172.31.254.61,104.166.182.206,TLSv1.3,1745,Application Data
260,LABEL_1,0.5429372787475586,261,26.407263,77.88.8.8,172.31.254.61,DNS,259,Standard query response 0x3dd5 Unknown (65) static.deepseek.com CNAME static.deepseek.com.436b7a4e.cdnhwcxcy07.com CNAME hcdnw120.vip.global.cdnhwctnm107.com SOA ns1.huaweicloud-dns.org
261,LABEL_1,0.5434402823448181,262,26.473189,104.166.182.206,172.31.254.61,TCP,60,443  >  55966 [ACK] Seq=5716 Ack=1812 Win=42496 Len=0
262,LABEL_1,0.5432888865470886,263,26.477005,104.166.182.206,172.31.254.61,TCP,60,443  >  55966 [ACK] Seq=5716 Ack=3172 Win=42496 Len=0
263,LABEL_1,0.5432590842247009,264,26.477006,104.166.182.206,172.31.254.61,TCP,60,443  >  55966 [ACK] Seq=5716 Ack=3503 Win=42496 Len=0
264,LABEL_1,0.5422896146774292,265,26.524112,172.31.254.61,88.212.252.200,TCP,55,55636  >  443 [ACK] Seq=1 Ack=1 Win=511 Len=1 [TCP segment of a reassembled PDU]
265,LABEL_1,0.5428606271743774,266,26.601024,88.212.252.200,172.31.254.61,TCP,66,443  >  55636 [ACK] Seq=1 Ack=2 Win=71 Len=0 SLE=1 SRE=2
266,LABEL_1,0.5435314178466797,267,26.647035,104.166.182.206,172.31.254.61,TLSv1.3,1058,Application Data
267,LABEL_1,0.5432060956954956,268,26.690792,172.31.254.61,104.166.182.206,TCP,54,55966  >  443 [ACK] Seq=3503 Ack=6720 Win=130816 Len=0
268,LABEL_1,0.5428714156150818,269,26.725104,172.31.254.61,77.88.8.8,DNS,79,Standard query 0x66f2 A static.deepseek.com
269,LABEL_1,0.5430386662483215,270,26.811888,77.88.8.8,172.31.254.61,DNS,277,Standard query response 0x1210 A static.deepseek.com CNAME static.deepseek.com.436b7a4e.cdnhwcxcy07.com CNAME hcdnw120.vip.global.cdnhwctnm107.com A 87.119.17.220 A 87.119.17.221 A 87.119.18.18 A 87.119.18.22 A 87.119.17.150 A 87.119.17.152
270,LABEL_1,0.5431286096572876,271,26.812520,172.31.254.61,87.119.17.220,TCP,66,55967  >  443 [SYN] Seq=0 Win=64240 Len=0 MSS=1460 WS=256 SACK_PERM=1
271,LABEL_1,0.5429806709289551,272,26.883199,87.119.17.220,172.31.254.61,TCP,66,"443  >  55967 [SYN, ACK] Seq=0 Ack=1 Win=29200 Len=0 MSS=1360 SACK_PERM=1 WS=1024"
272,LABEL_1,0.543181300163269,273,26.883278,172.31.254.61,87.119.17.220,TCP,54,55967  >  443 [ACK] Seq=1 Ack=1 Win=131840 Len=0
273,LABEL_1,0.543405294418335,274,26.885874,172.31.254.61,87.119.17.220,TLSv1.3,571,Client Hello
274,LABEL_1,0.5418280363082886,275,26.933611,Alcatel-_80:04:71,Spanning-tree-(for-bridges)_00,STP,60,RST. Root = 32768/0/00:e0:b1:c9:42:f7  Cost = 4  Port = 0x740f
275,LABEL_1,0.5431954860687256,276,26.957142,87.119.17.220,172.31.254.61,TCP,60,443  >  55967 [ACK] Seq=1 Ack=518 Win=30720 Len=0
276,LABEL_1,0.543215811252594,277,26.958539,87.119.17.220,172.31.254.61,TLSv1.3,1414,"Server Hello, Change Cipher Spec, Application Data"
277,LABEL_1,0.542567253112793,278,26.958625,87.119.17.220,172.31.254.61,TCP,1414,443  >  55967 [ACK] Seq=1361 Ack=518 Win=30720 Len=1360 [TCP segment of a reassembled PDU]
278,LABEL_1,0.5433921813964844,279,26.958643,172.31.254.61,87.119.17.220,TCP,54,55967  >  443 [ACK] Seq=518 Ack=2721 Win=131840 Len=0
279,LABEL_1,0.542536735534668,280,26.958736,87.119.17.220,172.31.254.61,TCP,1414,443  >  55967 [ACK] Seq=2721 Ack=518 Win=30720 Len=1360 [TCP segment of a reassembled PDU]
280,LABEL_1,0.5421461462974548,281,26.958737,87.119.17.220,172.31.254.61,TCP,70,"443  >  55967 [PSH, ACK] Seq=4081 Ack=518 Win=30720 Len=16 [TCP segment of a reassembled PDU]"
281,LABEL_1,0.5434383749961853,282,26.958761,172.31.254.61,87.119.17.220,TCP,54,55967  >  443 [ACK] Seq=518 Ack=4097 Win=131840 Len=0
282,LABEL_1,0.5433819890022278,283,26.959865,87.119.17.220,172.31.254.61,TLSv1.3,919,"Application Data, Application Data, Application Data"
